{
  "schema_version": 1,
  "decision_id": "D-20260812-057",
  "title": "40子意识形态五维默认坐标表（T-044，主agent起草，待用户整表审核）",
  "spectrum": {
    "e": "economy",
    "p": "power_structure",
    "f": "foreign_identity",
    "l": "left_right",
    "o": "order_stance"
  },
  "thresholds": {
    "regime": {
      "decentralized_max": -30,
      "authoritarian_min": 40
    },
    "engine_pole": {
      "communism_l_max": -50,
      "communism_e_min": 50,
      "communism_o_max": -40,
      "fascism_l_min": 60,
      "fascism_f_min": 60,
      "fascism_p_min": 40,
      "democratic_p_max": -30
    }
  },
  "default_coordinates": {
    "traditional_monarchism": {"e": 20, "p": 70, "f": 40, "l": 60, "o": 70},
    "confucian_conservatism": {"e": 30, "p": 60, "f": 30, "l": 50, "o": 50},
    "theocratic_conservatism": {"e": 20, "p": 80, "f": 50, "l": 70, "o": 80},
    "regional_conservatism": {"e": 0, "p": 40, "f": 20, "l": 30, "o": 40},
    "aristocratic_constitutionalism": {"e": -10, "p": -35, "f": 30, "l": 40, "o": 30},
    "classical_liberalism": {"e": -70, "p": -40, "f": -10, "l": 20, "o": 10},
    "commercial_liberalism": {"e": -60, "p": -30, "f": -20, "l": 10, "o": 0},
    "port_liberalism": {"e": -50, "p": -30, "f": -40, "l": 0, "o": 0},
    "constitutional_liberalism": {"e": -40, "p": -50, "f": 0, "l": 0, "o": 10},
    "moderate_republicanism": {"e": -20, "p": -50, "f": -10, "l": -10, "o": -20},
    "jacobin_republicanism": {"e": 10, "p": -60, "f": 30, "l": -20, "o": -40},
    "social_republicanism": {"e": 20, "p": -50, "f": -20, "l": -30, "o": -30},
    "federal_republicanism": {"e": -20, "p": -40, "f": 0, "l": -10, "o": 0},
    "radical_democracy": {"e": 0, "p": -70, "f": -20, "l": -40, "o": -50},
    "state_industrialism": {"e": 60, "p": 50, "f": 30, "l": 10, "o": 20},
    "technocratism": {"e": 50, "p": 40, "f": 0, "l": 0, "o": 10},
    "engineering_statism": {"e": 60, "p": 60, "f": 20, "l": 10, "o": 20},
    "state_capitalism": {"e": 50, "p": 30, "f": 10, "l": 20, "o": 10},
    "practical_learning_reformism": {"e": 40, "p": 20, "f": 0, "l": -10, "o": -10},
    "democratic_socialism": {"e": 50, "p": -40, "f": -30, "l": -50, "o": -20},
    "syndicalism": {"e": 70, "p": -30, "f": -40, "l": -70, "o": -60},
    "cooperative_socialism": {"e": 50, "p": -30, "f": -20, "l": -50, "o": -30},
    "state_socialism": {"e": 80, "p": 40, "f": 10, "l": -60, "o": -40},
    "worker_self_management": {"e": 60, "p": -50, "f": -30, "l": -60, "o": -60},
    "tianxiaism": {"e": 30, "p": 30, "f": 60, "l": 20, "o": 40},
    "persian_civilizational_revival": {"e": 30, "p": 30, "f": 50, "l": 10, "o": 30},
    "arab_civilizational_revival": {"e": 30, "p": 30, "f": 60, "l": 10, "o": 40},
    "inca_civilizational_revival": {"e": 20, "p": 20, "f": 60, "l": -10, "o": 20},
    "ethiopian_civilizational_revival": {"e": 20, "p": 40, "f": 50, "l": 10, "o": 30},
    "pan_turkic_civilizationalism": {"e": 30, "p": 30, "f": 70, "l": 0, "o": 20},
    "pan_slavic_civilizationalism": {"e": 30, "p": 30, "f": 70, "l": 0, "o": 30},
    "liberal_imperialism": {"e": -30, "p": -35, "f": 50, "l": 20, "o": 20},
    "civilizational_imperialism": {"e": 10, "p": 20, "f": 60, "l": 10, "o": 30},
    "tianxia_imperialism": {"e": 20, "p": 40, "f": 60, "l": 30, "o": 40},
    "islamic_imperialism": {"e": 20, "p": 50, "f": 50, "l": 40, "o": 40},
    "federal_imperialism": {"e": 10, "p": 10, "f": 30, "l": 10, "o": 20},
    "islamic_modernism": {"e": 30, "p": 10, "f": 30, "l": -10, "o": 10},
    "confucian_modernism": {"e": 30, "p": 10, "f": 20, "l": 0, "o": 0},
    "orthodox_modernism": {"e": 20, "p": 30, "f": 40, "l": 30, "o": 30},
    "catholic_socialism": {"e": 40, "p": -35, "f": 0, "l": -20, "o": 0}
  }
}
